{
  "$schema": "http://json-schema.org/draft-04/schema#",
  "definitions": {
    "bitfield": {
      "type": "object",
      "properties": {
        "index": {
          "type": "integer",
          "minimum": 0
        },
        "name": {
          "$ref": "#/definitions/name"
        }
      },
      "required": ["index", "name"]
    },
    "command": {
      "type": "object",
      "properties": {
        "fields": {
          "type": "array",
          "items": {
            "$ref": "#/definitions/field"
          }
        }
      },
      "required": ["fields"]
    },
    "field": {
      "type": "object",
      "oneOf": [
        {
          "properties": {
            "type": {
              "enum": ["bitfield"]
            },
            "bits": {
              "type": "array",
              "items": {
                "$ref": "#/definitions/bitfield"
              }
            },
            "size": {
              "type": "integer",
              "multipleOf": 8
            }
          },
          "required": ["bits", "type", "size"]
        },
        {
          "properties": {
            "type": {
              "enum": ["bool"]
            },
            "name": {
              "$ref": "#/definitions/name"
            }
          },
          "required": ["name", "type"]
        },
        {
          "properties": {
            "type": {
              "enum": ["int8", "int16", "int32", "int64",
                       "uint8", "uint16", "uint32", "uint64"]
            },
            "name": {
              "$ref": "#/definitions/name"
            },
            "labels": {
              "type": "array",
              "items": {
                "$ref": "#/definitions/label"
              }
            },
            "prefix": {
              "type": "integer",
              "maximum": 255,
              "minimum": 0
            },
            "ranges": {
              "type": "array",
              "items": {
                "$ref": "#/definitions/range"
              }
            },
            "unit": {
              "type": "integer",
              "maximum": 255,
              "minimum": 0
            }
          },
          "required": ["name", "type"]
        },
        {
          "properties": {
            "type": {
              "enum": ["string"]
            },
            "name": {
              "$ref": "#/definitions/name"
            },
            "max_size": {
              "type": "integer",
              "minimum": 0,
              "exclusiveMinimum": true
            },
            "min_size": {
              "type": "integer",
              "minimum": 0
            }
          },
          "required": ["name", "type"]
        },
        {
          "properties": {
            "type": {
              "enum": ["ipv4"]
            },
            "name": {
              "$ref": "#/definitions/name"
            }
          },
          "required": ["name", "type"]
        },
        {
          "properties": {
            "type": {
              "enum": ["mac"]
            },
            "name": {
              "$ref": "#/definitions/name"
            }
          },
          "required": ["name", "type"]
        },
        {
          "properties": {
            "type": {
              "enum": ["uid"]
            },
            "name": {
              "$ref": "#/definitions/name"
            }
          },
          "required": ["name", "type"]
        },
        {
          "properties": {
            "type": {
              "enum": ["group"]
            },
            "name": {
              "$ref": "#/definitions/name"
            },
            "fields": {
              "type": "array",
              "items": {
                "$ref": "#/definitions/field"
              }
            },
            "max_size": {
              "type": "integer",
              "minimum": 0,
              "exclusiveMinimum": true
            },
            "min_size": {
              "type": "integer",
              "minimum": 0
            }
          },
          "required": ["name", "fields", "type"]
        }
      ]
    },
    "label": {
      "type": "object",
      "properties": {
        "label": {
          "minLength": 1,
          "type": "string"
        },
        "value": {
          "type": "integer",
          "maximum": 4294967295,
          "minimum": 0
        }
      },
      "required": ["label", "value"]
    },
    "name": {
      "type": "string",
      "minLength": 1
    },
    "range": {
      "type": "object",
      "properties": {
        "lower": {
          "type": "integer"
        },
        "upper": {
          "type": "integer"
        }
      },
      "required": ["lower", "upper"]
    }
  },
  "type": "object",
  "properties": {
    "get_request": {
      "$ref": "#/definitions/command"
    },
    "get_response": {
      "$ref": "#/definitions/command"
    },
    "get_subdevice_range": {
      "maximum": 3,
      "minimum": 0,
      "type": "integer"
    },
    "name": {
      "minLength": 1,
      "type": "string"
    },
    "pid": {
      "maximum": 65535,
      "minimum": 0,
      "type": "integer"
    },
    "set_request": {
      "$ref": "#/definitions/command"
    },
    "set_response": {
      "$ref": "#/definitions/command"
    },
    "set_subdevice_range": {
      "maximum": 3,
      "minimum": 0,
      "type": "integer"
    },
    "version": {
      "minimum": 0,
      "type": "integer"
    }
  },
  "required": ["name", "pid", "version"],
  "dependencies": {
    "get_request": ["get_response", "get_subdevice_range"],
    "get_response": ["get_request", "get_subdevice_range"],
    "get_subdevice_range": ["get_request", "get_response"],
    "set_request": ["set_response", "set_subdevice_range"],
    "set_response": ["set_request", "set_subdevice_range"],
    "set_subdevice_range": ["set_request", "set_response"]
  }
}
